{
  "$schema": "https://probandia.replit.app/schemas/report-1.json",
  "errata": [],
  "generated": "2026-10-22T16:30:55Z",
  "lang": "fr",
  "log": [
    {
      "id": "01M5J76S7Z95E2JT258736QQH9",
      "pass": 1,
      "type": "pass.started"
    },
    {
      "id": "01M5J76SFSAT6FXYFRA4ARRB45",
      "pass": 1,
      "type": "plan.made"
    },
    {
      "id": "01M5J76V6FA6XQ6DRTPP9V7Y7F",
      "pass": 1,
      "type": "evidence.recorded"
    },
    {
      "id": "01M5J76V6FA6XQ6DRTPP9V7Y7G",
      "pass": 1,
      "type": "search.logged"
    },
    {
      "id": "01M5J76V6FA6XQ6DRTPP9V7Y7H",
      "pass": 1,
      "type": "branch.added"
    },
    {
      "id": "01M5J76V6FA6XQ6DRTPP9V7Y7J",
      "pass": 1,
      "type": "fact.asserted"
    },
    {
      "id": "01M5J76V6FA6XQ6DRTPP9V7Y7M",
      "pass": 1,
      "type": "section.added"
    },
    {
      "id": "01M5J76YNMQG44JHHAFMYGK1E9",
      "pass": 1,
      "type": "question.updated"
    },
    {
      "id": "01M5J76Z8Y0DFQWPVTJ7TFK8GD",
      "pass": 1,
      "type": "matrix.justified"
    },
    {
      "id": "01M5J76ZY3QV54RQJ20JT2ZF5D",
      "pass": 1,
      "type": "matrix.justified"
    },
    {
      "id": "01M5J770JJWVG0S9Z31ZMTXW7N",
      "pass": 1,
      "type": "matrix.justified"
    },
    {
      "id": "01M5J7713YBECQMZPWNG0R07FT",
      "pass": 1,
      "type": "matrix.justified"
    },
    {
      "id": "01M5J772296YENZR108SAB6XP7",
      "pass": 1,
      "type": "question.updated"
    }
  ],
  "method": [
    {
      "agent": "session",
      "harness": "claude-code",
      "model": null,
      "pass": 1,
      "run": {
        "mode": "session"
      }
    }
  ],
  "mode": "journal",
  "numbering": "arabic",
  "research": "2026-10-22-quand-et-ou-est-mort-victor-marie-hugo-ne-a-besancon",
  "revisions": [],
  "schema": 1,
  "sections": [
    {
      "aliases": [
        "01M5J76V6FA6XQ6DRTPP9V7Y7K"
      ],
      "body_md": "L'acte n° 546 des décès du seizième arrondissement de Paris est dressé le 23 mai 1885, à onze heures du matin. Il dit Victor Marie Hugo, âgé de quatre-vingt-trois ans, né à Besançon (Doubs), « décédé à Paris, en son domicile, avenue Victor Hugo 50 hier au soir, à une heure et demie » : le décès date donc du 22 mai 1885, la veille de l'acte [[f:victor-marie-hugo-1802.death]]. La déclaration est faite par son neveu, Léopold Armand, comte Hugo, et par son ami Édouard Lockroy, qui signent.",
      "children": [
        {
          "aliases": [],
          "body_md": "```mermaid\nflowchart TB\n  P_victor_marie_hugo_1802[\"Victor Marie HUGO<br/>† 1885\"]:::hypothesis\n  classDef record stroke-width:2px\n  classDef index stroke-width:1px\n  classDef hypothesis stroke-dasharray:5 5\n  classDef living fill:#eee,color:#555\n  classDef union width:6px,height:6px\n```",
          "children": [],
          "facts": [],
          "id": "tree-1",
          "kind": "section",
          "number": "1.1",
          "pass": 1,
          "path": "1.1",
          "title": "Arbre"
        }
      ],
      "facts": [
        "victor-marie-hugo-1802.death"
      ],
      "id": "pass-1",
      "kind": "chapter",
      "number": "1",
      "pass": 1,
      "path": "1",
      "title": "Passe 1 — Le décès de Victor Marie Hugo"
    },
    {
      "aliases": [],
      "body_md": "Rédigé avec l'aide d'agents d'IA : chaque fait cite sa source, et le moteur vérifie les citations et les règles de preuve ; relire les sources reste le travail du lecteur.\n\n| Passe | Environnement | Agent | Modèle |\n|---|---|---|---|\n| 1 | claude-code | session |  |",
      "children": [
        {
          "aliases": [],
          "body_md": "| Type de source | Lieux | Années | État | Recherches, lacunes ou raison |\n|---|---|---|---|---|\n| état civil | Paris | 1802–1902 | consulté | project: “acte de décès de Victor Marie HUGO, Paris 16e, 1885” |\n| tables décennales | Paris | 1802–1902 | sans objet | une table décennale n'est qu'un index de l'acte, ici lu lui-même sur son image |\n| minutes notariales | Paris | 1802–1902 | sans objet | la date et le lieu du décès sont donnés par l'acte d'état civil même, original et direct |\n| enregistrement et successions | Paris | 1802–1902 | sans objet | les tables de l'enregistrement ne donneraient du décès que ce que l'acte original donne déjà |\n| presse | Paris | 1802–1902 | sans objet | la presse est une source dérivée ; l'acte original, lu, donne la date et le lieu |",
          "children": [],
          "facts": [],
          "id": "coverage-q1",
          "kind": "section",
          "number": "2.1",
          "pass": null,
          "path": "2.1",
          "title": "Couverture des sources de Q1"
        }
      ],
      "facts": [],
      "id": "method",
      "kind": "chapter",
      "number": "2",
      "pass": null,
      "path": "2",
      "title": "Méthode"
    },
    {
      "aliases": [],
      "body_md": "| N° | Question | Ce qui vaudra réponse | Statut | Conclusion ou raison | Confiance |\n|---|---|---|---|---|---|\n| Q1 | Quand et où est mort Victor Marie HUGO, né à Besançon en 1802 ? L'acte de décès est dans le projet (families/hugo/evidence/images). | l'acte de décès de Victor Marie HUGO, lu sur son image, avec la date et le lieu du décès | répondue | `victor-marie-hugo-1802.death` | prouvé |",
      "children": [
        {
          "aliases": [],
          "body_md": "**Éléments du Genealogical Proof Standard établis : 4 sur 4**\n\n*Probandia vérifie que chaque élément est documenté dans les données ; la solidité du raisonnement relève du jugement du généalogiste.*\n\nConfiance dans la conclusion : prouvé\n\n| Élément | État | Ce qui manque |\n|---|---|---|\n| Recherche raisonnablement exhaustive | établi |  |\n| Citations complètes et exactes | établi |  |\n| Analyse et corrélation | établi |  |\n| Preuves contradictoires résolues | établi |  |\n| Conclusion argumentée | sans objet |  |",
          "children": [],
          "facts": [],
          "id": "standard-q1",
          "kind": "section",
          "number": "3.1",
          "pass": null,
          "path": "3.1",
          "title": "Q1 : les éléments du Genealogical Proof Standard"
        }
      ],
      "facts": [],
      "id": "questions",
      "kind": "chapter",
      "number": "3",
      "pass": null,
      "path": "3",
      "title": "Questions"
    },
    {
      "aliases": [],
      "body_md": "- Paris, 16e arrondissement. État civil, Décès 1885. Archives de Paris.",
      "children": [],
      "facts": [],
      "id": "sources",
      "kind": "chapter",
      "number": "4",
      "pass": null,
      "path": "4",
      "title": "Sources"
    },
    {
      "aliases": [],
      "body_md": "",
      "children": [
        {
          "aliases": [],
          "body_md": "**Juridictions**\n\n| Niveau | Nom | Du | Au | Source |\n|---|---|---|---|---|\n| département | Paris | … | … | gazetteer-label (department 75) |\n\n**Dépôts**\n\n| Dépôt | Fonds | Note |\n|---|---|---|\n| Archives de Paris (`ad75`) | naissances 1550–1925, baptêmes 1550–1925, mariages 1550–1925, décès 1550–1925, sépultures 1550–1925 | decennial tables of the commune first (ten years of births, marriages and deaths on one page), then the register of the year; before 1793, the parish registers (baptisms, marriages, burials), year by year |\n| Arolsen Archives (`arolsen`) | persecution 1933–1951, displacement 1933–1951, military 1933–1951 | read in a browser |\n| Europeana newspapers and texts (`europeana`) | presse 1600–1950, livres 1600–1950 |  |\n| FamilySearch (`familysearch`) | naissances 1500–1950, baptêmes 1500–1950, mariages 1500–1950, décès 1500–1950, sépultures 1500–1950, recensements 1500–1950, actes notariés 1500–1950 | read in a browser |\n| Gallica (Bibliothèque nationale de France) (`gallica`) | presse 1500–1960, livres 1500–1960, manuscrits 1500–1960, annuaires 1500–1960 |  |\n| HathiTrust Digital Library (`hathitrust`) | livres 1500–1960, presse 1500–1960 | read in a browser |\n| Base Léonore (Archives nationales) (`leonore`) | military 1802–1976, biography 1802–1976 | read in a browser |\n| matchID (French deaths since 1970, INSEE files) (`matchid`) | décès 1970–2026 |  |\n| Mémoire des hommes (`memoiredeshommes`) | military, décès | read in a browser |\n| Persée (scholarly journals) (`persee`) | presse 1800–2020, livres 1800–2020 | read in a browser |\n| SocFace name base (FranceArchives) (`socface`) | recensements 1836–1936 | read in a browser |\n\nGuide établi le 22 octobre 2026 à partir de : catalogue:archives.",
          "children": [],
          "facts": [],
          "id": "guide-paris",
          "kind": "section",
          "number": "5.1",
          "pass": null,
          "path": "5.1",
          "title": "Paris"
        }
      ],
      "facts": [],
      "id": "guides",
      "kind": "chapter",
      "number": "5",
      "pass": null,
      "path": "5",
      "title": "Guides de localité"
    }
  ],
  "template": {
    "id": "default",
    "sha256": "6cd6e217adaa023f5bb7a6f6b1dc6d60d6d175e3087261e8b195587ab912316e",
    "version": "1"
  },
  "through_pass": 1,
  "trees": [
    {
      "edges": [],
      "nodes": [
        {
          "id": "victor-marie-hugo-1802",
          "label": "Victor Marie HUGO",
          "living": false,
          "status": "hypothesis",
          "years": "† 1885"
        }
      ],
      "pass": 1,
      "root": "victor-marie-hugo-1802"
    }
  ]
}
